{"schema":"ling.semantic-transaction-result/0.1","transaction_schema":"ling.semantic-transaction/0.1","status":"validated","committed":false,"base_program_id":"experimental:blake3:0000000000000000000000000000000000000000000000000000000000000000","candidate_program_id":"experimental:blake3:3333333333333333333333333333333333333333333333333333333333333333","target_ids":["experimental:blake3:1111111111111111111111111111111111111111111111111111111111111111"],"changed_body_ids":["experimental:blake3:1111111111111111111111111111111111111111111111111111111111111111"],"preserved":["definition_set","types","effects","capabilities"],"provenance":{"actor":"fixture","reason":"authorized body update"}}
